{"label": "zero_shot", "cfg": null, "val_corr": {"n": 56, "wer_raw": 0.6855, "wer_norm": 0.6071, "cer_norm": 0.2689, "eval_seconds": 31.1, "per_category": {"article_pronoun": {"n": 2, "wer_norm": 0.5862}, "deletion": {"n": 2, "wer_norm": 0.6842}, "homophone": {"n": 6, "wer_norm": 0.6613}, "insertion": {"n": 3, "wer_norm": 0.9167}, "morphology": {"n": 1, "wer_norm": 0.2727}, "noun_case": {"n": 9, "wer_norm": 0.593}, "number_date": {"n": 1, "wer_norm": 0.5}, "person_name": {"n": 3, "wer_norm": 0.7619}, "place_name": {"n": 6, "wer_norm": 0.6133}, "punctuation_capitalization": {"n": 12, "wer_norm": 0.6}, "semantic_rewrite": {"n": 4, "wer_norm": 0.6842}, "substitution_phonetic": {"n": 27, "wer_norm": 0.5916}, "verb_inflection": {"n": 5, "wer_norm": 0.8298}, "word_boundary": {"n": 8, "wer_norm": 0.6905}}}, "val_reg": {"n": 70, "wer_raw": 0.74, "wer_norm": 0.6736, "cer_norm": 0.3763, "eval_seconds": 33.1}}
{"cfg": {"composition": "corrections_only", "sampling": "uniform", "error_focus": "none", "lr": 0.0001, "filters": "none", "steps": 40, "grad_accum": 4, "seed": 0}, "n_train": 279, "train": {"train_seconds": 77.7, "loss_first": 2.91, "loss_last": 1.21}, "val_corr": {"n": 56, "wer_raw": 0.6944, "wer_norm": 0.6174, "cer_norm": 0.2741, "eval_seconds": 29.4, "per_category": {"article_pronoun": {"n": 2, "wer_norm": 0.5862}, "deletion": {"n": 2, "wer_norm": 0.7895}, "homophone": {"n": 6, "wer_norm": 0.5968}, "insertion": {"n": 3, "wer_norm": 0.9167}, "morphology": {"n": 1, "wer_norm": 0.1818}, "noun_case": {"n": 9, "wer_norm": 0.6337}, "number_date": {"n": 1, "wer_norm": 0.7778}, "person_name": {"n": 3, "wer_norm": 0.7143}, "place_name": {"n": 6, "wer_norm": 0.6267}, "punctuation_capitalization": {"n": 12, "wer_norm": 0.5543}, "semantic_rewrite": {"n": 4, "wer_norm": 0.6842}, "substitution_phonetic": {"n": 27, "wer_norm": 0.6246}, "verb_inflection": {"n": 5, "wer_norm": 0.8511}, "word_boundary": {"n": 8, "wer_norm": 0.7976}}}, "val_reg": {"n": 70, "wer_raw": 0.518, "wer_norm": 0.4377, "cer_norm": 0.188, "eval_seconds": 26.3}, "label": "base_ft", "status": "discard", "delta_val_corr": 0.0103, "delta_val_reg": -0.2359}
{"cfg": {"composition": "corr+backbone_1x", "sampling": "uniform", "error_focus": "none", "lr": 0.0001, "filters": "none", "steps": 40, "grad_accum": 4, "seed": 0}, "n_train": 558, "train": {"train_seconds": 77.7, "loss_first": 2.04, "loss_last": 1.01}, "val_corr": {"n": 56, "wer_raw": 0.6855, "wer_norm": 0.6056, "cer_norm": 0.2758, "eval_seconds": 30.6, "per_category": {"article_pronoun": {"n": 2, "wer_norm": 0.5862}, "deletion": {"n": 2, "wer_norm": 0.8947}, "homophone": {"n": 6, "wer_norm": 0.5968}, "insertion": {"n": 3, "wer_norm": 0.8333}, "morphology": {"n": 1, "wer_norm": 0.1818}, "noun_case": {"n": 9, "wer_norm": 0.5988}, "number_date": {"n": 1, "wer_norm": 0.7222}, "person_name": {"n": 3, "wer_norm": 0.7143}, "place_name": {"n": 6, "wer_norm": 0.6133}, "punctuation_capitalization": {"n": 12, "wer_norm": 0.5829}, "semantic_rewrite": {"n": 4, "wer_norm": 0.6842}, "substitution_phonetic": {"n": 27, "wer_norm": 0.6036}, "verb_inflection": {"n": 5, "wer_norm": 0.7872}, "word_boundary": {"n": 8, "wer_norm": 0.7143}}}, "val_reg": {"n": 70, "wer_raw": 0.5427, "wer_norm": 0.4642, "cer_norm": 0.1943, "eval_seconds": 26.9}, "label": "comp_backbone_1x", "status": "keep", "delta_val_corr": -0.0015, "delta_val_reg": -0.2094}
{"cfg": {"composition": "corr+backbone_3x", "sampling": "uniform", "error_focus": "none", "lr": 0.0001, "filters": "none", "steps": 40, "grad_accum": 4, "seed": 0}, "n_train": 731, "train": {"train_seconds": 78.1, "loss_first": 1.287, "loss_last": 0.782}, "val_corr": {"n": 56, "wer_raw": 0.6944, "wer_norm": 0.61, "cer_norm": 0.2748, "eval_seconds": 30.0, "per_category": {"article_pronoun": {"n": 2, "wer_norm": 0.5862}, "deletion": {"n": 2, "wer_norm": 0.7895}, "homophone": {"n": 6, "wer_norm": 0.629}, "insertion": {"n": 3, "wer_norm": 0.8333}, "morphology": {"n": 1, "wer_norm": 0.1818}, "noun_case": {"n": 9, "wer_norm": 0.6279}, "number_date": {"n": 1, "wer_norm": 0.5556}, "person_name": {"n": 3, "wer_norm": 0.7143}, "place_name": {"n": 6, "wer_norm": 0.56}, "punctuation_capitalization": {"n": 12, "wer_norm": 0.5829}, "semantic_rewrite": {"n": 4, "wer_norm": 0.6842}, "substitution_phonetic": {"n": 27, "wer_norm": 0.6276}, "verb_inflection": {"n": 5, "wer_norm": 0.8085}, "word_boundary": {"n": 8, "wer_norm": 0.7738}}}, "val_reg": {"n": 70, "wer_raw": 0.5123, "wer_norm": 0.4283, "cer_norm": 0.1743, "eval_seconds": 26.9}, "label": "comp_backbone_3x", "status": "discard", "delta_val_corr": 0.0029, "delta_val_reg": -0.2453}
{"cfg": {"composition": "corrections_only", "sampling": "error_category_balanced", "error_focus": "none", "lr": 0.0001, "filters": "none", "steps": 40, "grad_accum": 4, "seed": 0}, "n_train": 2600, "train": {"train_seconds": 81.6, "loss_first": 1.359, "loss_last": 1.99}, "val_corr": {"n": 56, "wer_raw": 0.681, "wer_norm": 0.6145, "cer_norm": 0.272, "eval_seconds": 31.0, "per_category": {"article_pronoun": {"n": 2, "wer_norm": 0.5862}, "deletion": {"n": 2, "wer_norm": 0.8421}, "homophone": {"n": 6, "wer_norm": 0.7258}, "insertion": {"n": 3, "wer_norm": 0.8333}, "morphology": {"n": 1, "wer_norm": 0.1818}, "noun_case": {"n": 9, "wer_norm": 0.6279}, "number_date": {"n": 1, "wer_norm": 0.6111}, "person_name": {"n": 3, "wer_norm": 0.7143}, "place_name": {"n": 6, "wer_norm": 0.6267}, "punctuation_capitalization": {"n": 12, "wer_norm": 0.5714}, "semantic_rewrite": {"n": 4, "wer_norm": 0.7105}, "substitution_phonetic": {"n": 27, "wer_norm": 0.6036}, "verb_inflection": {"n": 5, "wer_norm": 0.7872}, "word_boundary": {"n": 8, "wer_norm": 0.7619}}}, "val_reg": {"n": 70, "wer_raw": 0.5313, "wer_norm": 0.4509, "cer_norm": 0.194, "eval_seconds": 26.9}, "label": "sample_cat_balanced", "status": "discard", "delta_val_corr": 0.0074, "delta_val_reg": -0.2227}
{"cfg": {"composition": "corrections_only", "sampling": "capped_oversample", "error_focus": "none", "lr": 0.0001, "filters": "none", "steps": 40, "grad_accum": 4, "seed": 0}, "n_train": 180, "train": {"train_seconds": 77.9, "loss_first": 1.948, "loss_last": 1.627}, "val_corr": {"n": 56, "wer_raw": 0.6766, "wer_norm": 0.6041, "cer_norm": 0.2729, "eval_seconds": 29.7, "per_category": {"article_pronoun": {"n": 2, "wer_norm": 0.569}, "deletion": {"n": 2, "wer_norm": 0.7895}, "homophone": {"n": 6, "wer_norm": 0.5968}, "insertion": {"n": 3, "wer_norm": 0.8333}, "morphology": {"n": 1, "wer_norm": 0.1818}, "noun_case": {"n": 9, "wer_norm": 0.6163}, "number_date": {"n": 1, "wer_norm": 0.6111}, "person_name": {"n": 3, "wer_norm": 0.7143}, "place_name": {"n": 6, "wer_norm": 0.6133}, "punctuation_capitalization": {"n": 12, "wer_norm": 0.5771}, "semantic_rewrite": {"n": 4, "wer_norm": 0.6842}, "substitution_phonetic": {"n": 27, "wer_norm": 0.6006}, "verb_inflection": {"n": 5, "wer_norm": 0.8085}, "word_boundary": {"n": 8, "wer_norm": 0.7619}}}, "val_reg": {"n": 70, "wer_raw": 0.5161, "wer_norm": 0.4321, "cer_norm": 0.181, "eval_seconds": 26.3}, "label": "sample_capped_oversample", "status": "keep", "delta_val_corr": -0.003, "delta_val_reg": -0.2415}
{"cfg": {"composition": "corrections_only", "sampling": "uniform", "error_focus": "acoustic", "lr": 0.0001, "filters": "none", "steps": 40, "grad_accum": 4, "seed": 0}, "n_train": 452, "train": {"train_seconds": 79.5, "loss_first": 1.818, "loss_last": 1.665}, "val_corr": {"n": 56, "wer_raw": 0.6914, "wer_norm": 0.6115, "cer_norm": 0.3153, "eval_seconds": 29.8, "per_category": {"article_pronoun": {"n": 2, "wer_norm": 0.6034}, "deletion": {"n": 2, "wer_norm": 0.7368}, "homophone": {"n": 6, "wer_norm": 0.6129}, "insertion": {"n": 3, "wer_norm": 0.9167}, "morphology": {"n": 1, "wer_norm": 0.1818}, "noun_case": {"n": 9, "wer_norm": 0.6337}, "number_date": {"n": 1, "wer_norm": 0.6111}, "person_name": {"n": 3, "wer_norm": 0.7143}, "place_name": {"n": 6, "wer_norm": 0.6267}, "punctuation_capitalization": {"n": 12, "wer_norm": 0.5543}, "semantic_rewrite": {"n": 4, "wer_norm": 0.6842}, "substitution_phonetic": {"n": 27, "wer_norm": 0.6366}, "verb_inflection": {"n": 5, "wer_norm": 0.7872}, "word_boundary": {"n": 8, "wer_norm": 0.7619}}}, "val_reg": {"n": 70, "wer_raw": 0.5427, "wer_norm": 0.466, "cer_norm": 0.2032, "eval_seconds": 26.5}, "label": "focus_acoustic", "status": "discard", "delta_val_corr": 0.0044, "delta_val_reg": -0.2076}
{"cfg": {"composition": "corrections_only", "sampling": "uniform", "error_focus": "none", "lr": 5e-05, "filters": "none", "steps": 40, "grad_accum": 4, "seed": 0}, "n_train": 279, "train": {"train_seconds": 78.8, "loss_first": 2.91, "loss_last": 1.252}, "val_corr": {"n": 56, "wer_raw": 0.7389, "wer_norm": 0.6588, "cer_norm": 0.3082, "eval_seconds": 31.1, "per_category": {"article_pronoun": {"n": 2, "wer_norm": 0.569}, "deletion": {"n": 2, "wer_norm": 0.6842}, "homophone": {"n": 6, "wer_norm": 0.5968}, "insertion": {"n": 3, "wer_norm": 0.9167}, "morphology": {"n": 1, "wer_norm": 0.1818}, "noun_case": {"n": 9, "wer_norm": 0.6163}, "number_date": {"n": 1, "wer_norm": 0.7778}, "person_name": {"n": 3, "wer_norm": 0.7619}, "place_name": {"n": 6, "wer_norm": 0.6267}, "punctuation_capitalization": {"n": 12, "wer_norm": 0.5486}, "semantic_rewrite": {"n": 4, "wer_norm": 0.6579}, "substitution_phonetic": {"n": 27, "wer_norm": 0.7117}, "verb_inflection": {"n": 5, "wer_norm": 0.7872}, "word_boundary": {"n": 8, "wer_norm": 0.7976}}}, "val_reg": {"n": 70, "wer_raw": 0.6812, "wer_norm": 0.6057, "cer_norm": 0.3197, "eval_seconds": 32.3}, "label": "lr_5e-5", "status": "discard", "delta_val_corr": 0.0517, "delta_val_reg": -0.0679}
{"cfg": {"composition": "corrections_only", "sampling": "uniform", "error_focus": "none", "lr": 0.0001, "filters": "strict", "steps": 40, "grad_accum": 4, "seed": 0}, "n_train": 216, "train": {"train_seconds": 78.9, "loss_first": 1.637, "loss_last": 0.885}, "val_corr": {"n": 56, "wer_raw": 0.7196, "wer_norm": 0.6381, "cer_norm": 0.3096, "eval_seconds": 29.9, "per_category": {"article_pronoun": {"n": 2, "wer_norm": 0.5862}, "deletion": {"n": 2, "wer_norm": 0.8947}, "homophone": {"n": 6, "wer_norm": 0.629}, "insertion": {"n": 3, "wer_norm": 0.9167}, "morphology": {"n": 1, "wer_norm": 0.1818}, "noun_case": {"n": 9, "wer_norm": 0.6105}, "number_date": {"n": 1, "wer_norm": 0.6111}, "person_name": {"n": 3, "wer_norm": 0.7143}, "place_name": {"n": 6, "wer_norm": 0.64}, "punctuation_capitalization": {"n": 12, "wer_norm": 0.6514}, "semantic_rewrite": {"n": 4, "wer_norm": 0.6842}, "substitution_phonetic": {"n": 27, "wer_norm": 0.6036}, "verb_inflection": {"n": 5, "wer_norm": 0.8085}, "word_boundary": {"n": 8, "wer_norm": 0.7262}}}, "val_reg": {"n": 70, "wer_raw": 0.5313, "wer_norm": 0.4509, "cer_norm": 0.1959, "eval_seconds": 26.6}, "label": "filters_strict", "status": "discard", "delta_val_corr": 0.031, "delta_val_reg": -0.2227}
{"cfg": {"composition": "corrections_only", "sampling": "capped_oversample", "error_focus": "none", "lr": 0.0001, "filters": "none", "steps": 40, "grad_accum": 4, "seed": 1}, "n_train": 180, "train": {"train_seconds": 79.5, "loss_first": 1.853, "loss_last": 1.567}, "val_corr": {"n": 56, "wer_raw": 0.681, "wer_norm": 0.6086, "cer_norm": 0.282, "eval_seconds": 30.0, "per_category": {"article_pronoun": {"n": 2, "wer_norm": 0.569}, "deletion": {"n": 2, "wer_norm": 0.7368}, "homophone": {"n": 6, "wer_norm": 0.5968}, "insertion": {"n": 3, "wer_norm": 0.8333}, "morphology": {"n": 1, "wer_norm": 0.1818}, "noun_case": {"n": 9, "wer_norm": 0.6279}, "number_date": {"n": 1, "wer_norm": 0.6111}, "person_name": {"n": 3, "wer_norm": 0.7143}, "place_name": {"n": 6, "wer_norm": 0.6267}, "punctuation_capitalization": {"n": 12, "wer_norm": 0.5657}, "semantic_rewrite": {"n": 4, "wer_norm": 0.6842}, "substitution_phonetic": {"n": 27, "wer_norm": 0.6216}, "verb_inflection": {"n": 5, "wer_norm": 0.766}, "word_boundary": {"n": 8, "wer_norm": 0.7619}}}, "val_reg": {"n": 70, "wer_raw": 0.5237, "wer_norm": 0.4415, "cer_norm": 0.1842, "eval_seconds": 26.5}, "label": "sample_capped_oversample#s1", "status": "discard"}
{"cfg": {"composition": "corrections_only", "sampling": "capped_oversample", "error_focus": "none", "lr": 0.0001, "filters": "none", "steps": 40, "grad_accum": 4, "seed": 2}, "n_train": 180, "train": {"train_seconds": 78.4, "loss_first": 1.446, "loss_last": 1.045}, "val_corr": {"n": 56, "wer_raw": 0.7344, "wer_norm": 0.6662, "cer_norm": 0.306, "eval_seconds": 31.0, "per_category": {"article_pronoun": {"n": 2, "wer_norm": 0.5862}, "deletion": {"n": 2, "wer_norm": 0.8421}, "homophone": {"n": 6, "wer_norm": 0.5968}, "insertion": {"n": 3, "wer_norm": 0.8333}, "morphology": {"n": 1, "wer_norm": 0.1818}, "noun_case": {"n": 9, "wer_norm": 0.8547}, "number_date": {"n": 1, "wer_norm": 0.6111}, "person_name": {"n": 3, "wer_norm": 0.7143}, "place_name": {"n": 6, "wer_norm": 0.6133}, "punctuation_capitalization": {"n": 12, "wer_norm": 0.5943}, "semantic_rewrite": {"n": 4, "wer_norm": 0.6842}, "substitution_phonetic": {"n": 27, "wer_norm": 0.7207}, "verb_inflection": {"n": 5, "wer_norm": 0.7872}, "word_boundary": {"n": 8, "wer_norm": 0.7619}}}, "val_reg": {"n": 70, "wer_raw": 0.5237, "wer_norm": 0.4396, "cer_norm": 0.1877, "eval_seconds": 26.4}, "label": "sample_capped_oversample#s2", "status": "discard"}
{"cfg": {"composition": "corr+backbone_1x", "sampling": "capped_oversample", "error_focus": "none", "lr": 0.0001, "filters": "none", "steps": 40, "grad_accum": 4, "seed": 0}, "n_train": 459, "train": {"train_seconds": 80.1, "loss_first": 1.652, "loss_last": 0.975}, "val_corr": {"n": 56, "wer_raw": 0.7047, "wer_norm": 0.6248, "cer_norm": 0.2786, "eval_seconds": 29.7, "per_category": {"article_pronoun": {"n": 2, "wer_norm": 0.5862}, "deletion": {"n": 2, "wer_norm": 0.8947}, "homophone": {"n": 6, "wer_norm": 0.7258}, "insertion": {"n": 3, "wer_norm": 0.9583}, "morphology": {"n": 1, "wer_norm": 0.1818}, "noun_case": {"n": 9, "wer_norm": 0.6047}, "number_date": {"n": 1, "wer_norm": 0.7778}, "person_name": {"n": 3, "wer_norm": 0.7143}, "place_name": {"n": 6, "wer_norm": 0.5733}, "punctuation_capitalization": {"n": 12, "wer_norm": 0.5771}, "semantic_rewrite": {"n": 4, "wer_norm": 0.6842}, "substitution_phonetic": {"n": 27, "wer_norm": 0.6156}, "verb_inflection": {"n": 5, "wer_norm": 0.8723}, "word_boundary": {"n": 8, "wer_norm": 0.7857}}}, "val_reg": {"n": 70, "wer_raw": 0.5237, "wer_norm": 0.4434, "cer_norm": 0.1851, "eval_seconds": 26.2}, "label": "r2_bb1x_capped", "status": "discard", "delta_val_corr": 0.0177, "delta_val_reg": -0.2302}
{"cfg": {"composition": "corr+backbone_1x", "sampling": "error_category_balanced", "error_focus": "none", "lr": 0.0001, "filters": "none", "steps": 40, "grad_accum": 4, "seed": 0}, "n_train": 2879, "train": {"train_seconds": 78.2, "loss_first": 1.724, "loss_last": 2.193}, "val_corr": {"n": 56, "wer_raw": 0.6929, "wer_norm": 0.6189, "cer_norm": 0.2715, "eval_seconds": 29.4, "per_category": {"article_pronoun": {"n": 2, "wer_norm": 0.5862}, "deletion": {"n": 2, "wer_norm": 0.7368}, "homophone": {"n": 6, "wer_norm": 0.5968}, "insertion": {"n": 3, "wer_norm": 0.875}, "morphology": {"n": 1, "wer_norm": 0.1818}, "noun_case": {"n": 9, "wer_norm": 0.6279}, "number_date": {"n": 1, "wer_norm": 0.6111}, "person_name": {"n": 3, "wer_norm": 0.7143}, "place_name": {"n": 6, "wer_norm": 0.6267}, "punctuation_capitalization": {"n": 12, "wer_norm": 0.5829}, "semantic_rewrite": {"n": 4, "wer_norm": 0.6842}, "substitution_phonetic": {"n": 27, "wer_norm": 0.6246}, "verb_inflection": {"n": 5, "wer_norm": 0.8298}, "word_boundary": {"n": 8, "wer_norm": 0.75}}}, "val_reg": {"n": 70, "wer_raw": 0.5522, "wer_norm": 0.4642, "cer_norm": 0.2026, "eval_seconds": 26.4}, "label": "r2_bb1x_balanced", "status": "discard", "delta_val_corr": 0.0118, "delta_val_reg": -0.2094}
{"cfg": {"composition": "corr+backbone_1x", "sampling": "uniform", "error_focus": "acoustic", "lr": 0.0001, "filters": "none", "steps": 40, "grad_accum": 4, "seed": 0}, "n_train": 731, "train": {"train_seconds": 79.7, "loss_first": 1.782, "loss_last": 1.709}, "val_corr": {"n": 56, "wer_raw": 0.7062, "wer_norm": 0.6278, "cer_norm": 0.2765, "eval_seconds": 29.4, "per_category": {"article_pronoun": {"n": 2, "wer_norm": 0.5862}, "deletion": {"n": 2, "wer_norm": 0.8947}, "homophone": {"n": 6, "wer_norm": 0.6452}, "insertion": {"n": 3, "wer_norm": 0.9583}, "morphology": {"n": 1, "wer_norm": 0.1818}, "noun_case": {"n": 9, "wer_norm": 0.6221}, "number_date": {"n": 1, "wer_norm": 0.6111}, "person_name": {"n": 3, "wer_norm": 0.7143}, "place_name": {"n": 6, "wer_norm": 0.6}, "punctuation_capitalization": {"n": 12, "wer_norm": 0.6}, "semantic_rewrite": {"n": 4, "wer_norm": 0.7105}, "substitution_phonetic": {"n": 27, "wer_norm": 0.6216}, "verb_inflection": {"n": 5, "wer_norm": 0.8085}, "word_boundary": {"n": 8, "wer_norm": 0.7619}}}, "val_reg": {"n": 70, "wer_raw": 0.5256, "wer_norm": 0.4453, "cer_norm": 0.1877, "eval_seconds": 26.2}, "label": "r2_bb1x_acoustic", "status": "discard", "delta_val_corr": 0.0207, "delta_val_reg": -0.2283}
{"cfg": {"composition": "corr+backbone_1x", "sampling": "capped_oversample", "error_focus": "acoustic", "lr": 0.0001, "filters": "none", "steps": 40, "grad_accum": 4, "seed": 0}, "n_train": 574, "train": {"train_seconds": 78.7, "loss_first": 1.611, "loss_last": 1.166}, "val_corr": {"n": 56, "wer_raw": 0.7003, "wer_norm": 0.6248, "cer_norm": 0.3013, "eval_seconds": 29.4, "per_category": {"article_pronoun": {"n": 2, "wer_norm": 0.5862}, "deletion": {"n": 2, "wer_norm": 0.8421}, "homophone": {"n": 6, "wer_norm": 0.629}, "insertion": {"n": 3, "wer_norm": 0.9583}, "morphology": {"n": 1, "wer_norm": 0.1818}, "noun_case": {"n": 9, "wer_norm": 0.6047}, "number_date": {"n": 1, "wer_norm": 0.6111}, "person_name": {"n": 3, "wer_norm": 0.7143}, "place_name": {"n": 6, "wer_norm": 0.5867}, "punctuation_capitalization": {"n": 12, "wer_norm": 0.64}, "semantic_rewrite": {"n": 4, "wer_norm": 0.6842}, "substitution_phonetic": {"n": 27, "wer_norm": 0.5976}, "verb_inflection": {"n": 5, "wer_norm": 0.8936}, "word_boundary": {"n": 8, "wer_norm": 0.7381}}}, "val_reg": {"n": 70, "wer_raw": 0.5142, "wer_norm": 0.4321, "cer_norm": 0.1848, "eval_seconds": 26.1}, "label": "r2_bb1x_capped_acoustic", "status": "discard", "delta_val_corr": 0.0177, "delta_val_reg": -0.2415}
{"cfg": {"composition": "corr+backbone_1x", "sampling": "uniform", "error_focus": "none", "lr": 5e-05, "filters": "none", "steps": 40, "grad_accum": 4, "seed": 0}, "n_train": 558, "train": {"train_seconds": 79.4, "loss_first": 2.04, "loss_last": 1.202}, "val_corr": {"n": 56, "wer_raw": 0.7433, "wer_norm": 0.6677, "cer_norm": 0.3041, "eval_seconds": 29.6, "per_category": {"article_pronoun": {"n": 2, "wer_norm": 0.569}, "deletion": {"n": 2, "wer_norm": 0.8421}, "homophone": {"n": 6, "wer_norm": 0.6452}, "insertion": {"n": 3, "wer_norm": 2.5}, "morphology": {"n": 1, "wer_norm": 0.1818}, "noun_case": {"n": 9, "wer_norm": 0.6279}, "number_date": {"n": 1, "wer_norm": 0.5556}, "person_name": {"n": 3, "wer_norm": 2.5714}, "place_name": {"n": 6, "wer_norm": 0.6133}, "punctuation_capitalization": {"n": 12, "wer_norm": 0.5771}, "semantic_rewrite": {"n": 4, "wer_norm": 0.7368}, "substitution_phonetic": {"n": 27, "wer_norm": 0.6126}, "verb_inflection": {"n": 5, "wer_norm": 0.766}, "word_boundary": {"n": 8, "wer_norm": 0.7381}}}, "val_reg": {"n": 70, "wer_raw": 0.6186, "wer_norm": 0.5377, "cer_norm": 0.258, "eval_seconds": 29.7}, "label": "r2_bb1x_lr5e-5", "status": "discard", "delta_val_corr": 0.0606, "delta_val_reg": -0.1359}
